{
  "story_id": "story_03_three_am_alarm",
  "version": "1.0.0",
  "schema_version": "1.0.0",
  "title": "凌晨三點的警示燈",
  "subtitle": "輪班現場突發狀況",
  "island_id": "island_night",
  "order": 3,
  "theme": "壓力、責任與求援",
  "logline": "黃燈轉起來的時候，線上只有三個人。原本應該有五個。",
  "estimated_minutes": 3,
  "content_notes": ["夜班", "工安風險", "人力不足"],
  "setting": {
    "location": "物流分揀中心，二號線。鐵皮屋頂，日光燈，輸送帶的聲音從來沒停過",
    "time": "星期四 凌晨 03:12",
    "conflict": "七點的貨要出。人不夠。而剛剛那個聲音，不是正常的聲音。"
  },
  "characters": [
    { "character_id": "you",   "name": "你",     "role": "夜班組員", "profile": "做夜班兩年。知道哪一段輸送帶會在濕氣重的時候打滑。", "voice": "工作時話少，動作快" },
    { "character_id": "hao",   "name": "阿豪",   "role": "新人",     "profile": "來三個禮拜。很認真，認真到有時候會做超出自己該做的事。", "voice": "語尾會上揚，常常問『這樣對嗎』" },
    { "character_id": "huang", "name": "黃主任", "role": "值班主管", "profile": "住在廠區二十分鐘外。電話永遠會接，但人不一定會來。", "voice": "睡醒的聲音，講話先吸一口氣" },
    { "character_id": "mei",   "name": "美姐",   "role": "早班組長", "profile": "做了十一年。交接本上她的字很用力，用力到背面會凸起來。", "voice": "直接，不繞" }
  ],
  "state_vars": [
    { "key": "help",   "label": "求援",     "init": 0, "description": "你讓別人加入或接手的程度" },
    { "key": "safety", "label": "安全把關", "init": 0, "description": "你把安全放在進度前面的程度" },
    { "key": "hold",   "label": "獨撐",     "init": 0, "description": "你自己扛下來的部分" },
    { "key": "voice",  "label": "開口",     "init": 0, "description": "你把狀況說出來、留下紀錄的程度" }
  ],
  "start_node_id": "n_03_open",
  "nodes": [
    {
      "node_id": "n_03_open",
      "node_type": "narration",
      "title": "開場",
      "scene": { "location": "二號線", "time": "凌晨 03:12", "mood": "規律到讓人恍神" },
      "dialogue": [
        { "speaker": "narration", "style": "narration", "text": "凌晨三點十二分。輸送帶的聲音像一條河，流了六個小時。" },
        { "speaker": "narration", "style": "narration", "text": "今晚該有五個人。有兩個請假，調不到人。" },
        { "speaker": "narration", "style": "narration", "text": "你、阿豪，還有在另一頭盤點的老張。七點的貨要出，進度剛好卡在一半。" }
      ],
      "next_node_id": "n_03_alarm"
    },
    {
      "node_id": "n_03_alarm",
      "node_type": "narration",
      "title": "警示燈",
      "scene": { "location": "二號線中段", "time": "凌晨 03:14", "mood": "聲音不對" },
      "dialogue": [
        { "speaker": "sfx", "style": "sfx", "text": "喀。喀喀。" },
        { "speaker": "narration", "style": "narration", "text": "聲音變了。不是平常那條河的聲音。" },
        { "speaker": "narration", "style": "narration", "text": "中段的黃燈轉起來，一圈一圈打在鐵皮屋頂上。" },
        { "speaker": "narration", "style": "narration", "text": "一個箱子歪在軌道接縫上，半個身體懸空，後面的箱子正在一個一個頂上去。" },
        { "speaker": "narration", "style": "narration", "text": "箱子側面印著：易碎・玻璃。" },
        { "speaker": "hao", "style": "line", "text": "欸！這個是不是要——" },
        { "speaker": "narration", "style": "narration", "text": "阿豪已經往前跨了一步，手伸出去。" }
      ],
      "next_node_id": "n_03_d1"
    },
    {
      "node_id": "n_03_d1",
      "node_type": "decision",
      "title": "決策點一：三秒鐘",
      "scene": { "location": "二號線中段", "time": "凌晨 03:14", "mood": "腎上腺素" },
      "dialogue": [
        { "speaker": "narration", "style": "narration", "text": "急停鈕在你左手邊兩公尺，紅色的蘑菇頭。按下去，整條線停，進度歸零重啟要十五分鐘。" }
      ],
      "choices": [
        {
          "choice_id": "c_03_d1_fix",
          "text": "自己先上去把箱子扶正",
          "hint": "線不要停，快一點就好",
          "immediate": [
            { "speaker": "you", "style": "line", "text": "你退開，我來。" },
            { "speaker": "narration", "style": "narration", "text": "你側身跨到檢修踏板上，一手撐著護欄，一手去搆那個箱子。" },
            { "speaker": "narration", "style": "narration", "text": "輸送帶在你腳邊繼續跑。你抓到箱子的邊角，用力一推——" },
            { "speaker": "sfx", "style": "sfx", "text": "咚。" },
            { "speaker": "narration", "style": "narration", "text": "箱子歸位，後面的隊伍重新流動。黃燈熄了。" },
            { "speaker": "narration", "style": "narration", "text": "你跳下踏板，手心全是汗。整件事花了二十二秒。" }
          ],
          "consequence": "線沒有停，進度保住了，而你剛剛在運轉中的機台上伸了手。",
          "inner_voice_clue": {
            "clue_id": "clue_03_twenty_two_seconds",
            "title": "心聲線索",
            "text": "你很熟練，所以你知道這樣做得到。熟練是真的，風險也是真的——這兩件事不衝突。值得問自己一句：剛剛那二十二秒，是我選的，還是進度幫我選的？"
          },
          "state_effects": [
            { "var": "hold", "op": "add", "value": 2 },
            { "var": "safety", "op": "add", "value": -1 }
          ],
          "tags": ["hold"],
          "next_node_id": "n_03_a1"
        },
        {
          "choice_id": "c_03_d1_stop",
          "text": "立刻按下急停，再通報",
          "hint": "先停，其他的之後再說",
          "immediate": [
            { "speaker": "you", "style": "line", "text": "阿豪，手收回來！" },
            { "speaker": "narration", "style": "narration", "text": "你兩步跨過去，手掌拍在紅色蘑菇頭上。" },
            { "speaker": "sfx", "style": "sfx", "text": "整條線慢下來，停住。那條河第一次安靜。" },
            { "speaker": "narration", "style": "narration", "text": "安靜得你耳鳴。阿豪站在原地，手還半舉著。" },
            { "speaker": "hao", "style": "line", "text": "⋯⋯啊。對不起。" },
            { "speaker": "you", "style": "line", "text": "不是你的錯。線在跑的時候不能伸手，這是規定。" }
          ],
          "consequence": "線停了，十五分鐘的進度沒了，阿豪的手還在。",
          "inner_voice_clue": {
            "clue_id": "clue_03_the_button",
            "title": "心聲線索",
            "text": "按下急停會讓你被看見——燈會亮、紀錄會留、有人會問為什麼。不按，沒有人會知道。這就是為什麼很多人選擇不按。你按了。"
          },
          "state_effects": [
            { "var": "safety", "op": "add", "value": 2 },
            { "var": "voice", "op": "add", "value": 1 }
          ],
          "tags": ["safety", "speak"],
          "next_node_id": "n_03_b1"
        },
        {
          "choice_id": "c_03_d1_team",
          "text": "叫阿豪一起處理，同時打給主任",
          "hint": "兩個人做，而且讓上面知道",
          "immediate": [
            { "speaker": "you", "style": "line", "text": "阿豪，按急停，我打電話。站在按鈕旁邊不要動。" },
            { "speaker": "narration", "style": "narration", "text": "線停下來。你一邊看著那個歪掉的箱子，一邊撥號。響了四聲。" },
            { "speaker": "huang", "style": "line", "text": "⋯⋯喂。" },
            { "speaker": "you", "style": "line", "text": "主任，二號線中段卡箱，易碎品，我們已經急停。現在線上只有三個人。" },
            { "speaker": "huang", "style": "line", "text": "等一下，我開個燈。" },
            { "speaker": "narration", "style": "narration", "text": "電話那頭傳來拖鞋的聲音。" }
          ],
          "consequence": "線停了，人到位了，而且這件事現在不只你一個人知道。",
          "inner_voice_clue": {
            "clue_id": "clue_03_two_people",
            "title": "心聲線索",
            "text": "你同時做了兩件事：把人配好，把訊息送出去。這代表你在混亂裡還保有判斷力。現場最容易丟掉的就是這個——因為所有的壓力都在叫你趕快動手。"
          },
          "state_effects": [
            { "var": "help", "op": "add", "value": 2 },
            { "var": "safety", "op": "add", "value": 1 }
          ],
          "tags": ["help", "safety"],
          "next_node_id": "n_03_c1"
        }
      ]
    },
    {
      "node_id": "n_03_a1",
      "node_type": "narration",
      "title": "分支 A：沒有人看見的二十二秒",
      "scene": { "location": "二號線", "time": "凌晨 03:16", "mood": "心跳還沒下來" },
      "dialogue": [
        { "speaker": "hao", "style": "line", "text": "哇⋯⋯你好厲害喔。" },
        { "speaker": "hao", "style": "line", "text": "那下次如果我遇到，也可以這樣用嗎？" },
        { "speaker": "narration", "style": "narration", "text": "你張開嘴，又閉上。" },
        { "speaker": "inner", "style": "inner", "text": "他是在問一個做法。而他會照著做。" }
      ],
      "next_node_id": "n_03_merge1"
    },
    {
      "node_id": "n_03_b1",
      "node_type": "narration",
      "title": "分支 B：安靜的十五分鐘",
      "scene": { "location": "二號線", "time": "凌晨 03:20", "mood": "等重啟" },
      "dialogue": [
        { "speaker": "narration", "style": "narration", "text": "你把箱子搬下來，玻璃沒破。系統跳出一行紅字：異常停機・需填報。" },
        { "speaker": "narration", "style": "narration", "text": "重啟要十五分鐘。你看了一下進度條，七點的貨，開始有點危險。" },
        { "speaker": "narration", "style": "narration", "text": "手機震動。黃主任看到停機通知了。" }
      ],
      "next_node_id": "n_03_merge1"
    },
    {
      "node_id": "n_03_c1",
      "node_type": "narration",
      "title": "分支 C：電話那頭的拖鞋聲",
      "scene": { "location": "二號線", "time": "凌晨 03:19", "mood": "等指示" },
      "dialogue": [
        { "speaker": "narration", "style": "narration", "text": "阿豪把箱子搬下來。玻璃沒破。" },
        { "speaker": "hao", "style": "line", "text": "剛剛我差點就伸手了。" },
        { "speaker": "you", "style": "line", "text": "我知道。所以我才叫你去按按鈕。" },
        { "speaker": "narration", "style": "narration", "text": "電話那頭，黃主任正在看系統的遠端畫面。" }
      ],
      "next_node_id": "n_03_merge1"
    },
    {
      "node_id": "n_03_merge1",
      "node_type": "converge",
      "title": "匯流一：主任的那句話",
      "converge_from": ["n_03_a1", "n_03_b1", "n_03_c1"],
      "scene": { "location": "二號線", "time": "凌晨 03:24", "mood": "問題從機台轉到人" },
      "dialogue": [
        { "speaker": "narration", "style": "narration", "text": "黃主任的聲音從電話裡出來，背景有電視的聲音被關掉。" },
        { "speaker": "huang", "style": "line", "text": "狀況我知道了。那個接縫下禮拜排保養。" },
        { "speaker": "huang", "style": "line", "text": "現在調不到人，派遣那邊也沒有。七點那批一定要出，客戶那邊我扛不住。" },
        { "speaker": "huang", "style": "line", "text": "你們三個⋯⋯撐到早班，可以嗎？" },
        { "speaker": "narration", "style": "narration", "text": "「可以嗎」三個字，聽起來像在問你。" },
        { "speaker": "inner", "style": "inner", "text": "但如果你說不可以，接下來要處理的是什麼，你也知道。" }
      ],
      "next_node_id": "n_03_d2"
    },
    {
      "node_id": "n_03_d2",
      "node_type": "decision",
      "title": "決策點二：撐到早班",
      "scene": { "location": "二號線", "time": "凌晨 03:25", "mood": "責任落在手上" },
      "dialogue": [
        { "speaker": "narration", "style": "narration", "text": "距離早班交接還有三小時三十五分。阿豪在旁邊等你回答。" }
      ],
      "choices": [
        {
          "choice_id": "c_03_d2_comply",
          "text": "說可以，三個人撐完",
          "hint": "講出來也不會多一個人",
          "immediate": [
            { "speaker": "you", "style": "line", "text": "好，我們處理。" },
            { "speaker": "narration", "style": "narration", "text": "電話掛了。你轉頭，阿豪的眼睛是紅的——不是哭，是太久沒睡。" },
            { "speaker": "narration", "style": "narration", "text": "接下來三個半小時，你們三個人做五個人的事。" },
            { "speaker": "narration", "style": "narration", "text": "六點四十，最後一板上車。你靠在柱子上，發現自己從三點以後沒有喝過水。" }
          ],
          "consequence": "貨準時出了。三個人做完五個人的量，這件事沒有被記在任何地方。",
          "inner_voice_clue": {